﻿Spotify URI,Track Name,Artist Name,Album Name,Disc Number,Track Number,Track Duration (ms),Added By,Added At
"spotify:track:6tHpxFDLucR3Xs9nivuyiO","We Are Sex Bob-Omb","Sex Bob-Omb","Scott Pilgrim vs. the World (Original Motion Picture Soundtrack)","1","1","121333","spotify:user:trinity3infinity","2016-02-18T17:34:36Z"
"spotify:track:0A4PZuepTcIQVvA5m7R0M1","Don't You (Forget About Me)","Simple Minds","Celebrate Greatest Hits","1","14","260680","spotify:user:215iyqxnackx5ekss5adqd73a","2016-02-18T17:33:29Z"
"spotify:track:2AkcjsKlRbIBYGAgpQVFii","Comptine d'un autre été, l'après-midi","Yann Tiersen","Amelie from Montmartre","1","4","140733","spotify:user:215iyqxnackx5ekss5adqd73a","2016-02-18T17:34:00Z"
"spotify:track:3XfpPDqZtqsqECTQBD96UB","Two New Alphas","John Powell","How to Train Your Dragon 2 (Music from the Motion Picture)","1","18","365080","spotify:user:215iyqxnackx5ekss5adqd73a","2016-02-18T17:36:18Z"
"spotify:track:3srcCsCjdbsXQKoWLCXFe5","Any Other Name","Thomas Newman","American Beauty (Soundtrack)","1","18","246626","spotify:user:215iyqxnackx5ekss5adqd73a","2016-02-18T17:37:14Z"
"spotify:track:1rWiMhHvRua3jPyKAY43nB","First Class","Henry Jackman","X-MEN: FIRST CLASS","1","1","200226","spotify:user:215iyqxnackx5ekss5adqd73a","2016-02-18T17:34:17Z"
"spotify:track:4O6ZaZrRCFfiZZKjnrXqlk","That Thing You Do!","The Wonders","That Thing You Do! Original Motion Picture Soundtrack","1","2","166773","spotify:user:trinity3infinity","2016-02-18T17:39:31Z"
"spotify:track:3x3RacxQ19Lghu46faO9DA","Belleville rendez-vous","M","The Triplets Of Belleville","1","2","190973","spotify:user:irregulargalaxies","2016-02-18T17:46:59Z"
"spotify:track:3glMshxOsUKmwbPPRXXZhz","Barra Barra","Rachid Taha","Black Hawk Down - Original Motion Picture Soundtrack","1","2","347800","spotify:user:irregulargalaxies","2016-02-18T17:48:50Z"
"spotify:track:6A8uGdTrAKWoJ4pf81pjwW","A Mighty Wind","The Folksmen, Mitch & Mickey, The New Main Street Singers","A Mighty Wind - The Album","1","17","135800","spotify:user:irregulargalaxies","2016-02-18T17:47:31Z"
"spotify:track:3XbiTbEktENk8Y242Y2Sy5","Can You Picture That? - From "The Muppet Movie"/Soundtrack Version","Dr. Teeth and The Electric Mayhem","The Muppet Movie (Original Motion Picture Soundtrack)","1","6","153040","spotify:user:irregulargalaxies","2016-02-18T17:48:33Z"
"spotify:track:47aMbtetHwI7tLR9Z7iec7","Summer Overture","Clint Mansell, Kronos Quartet","Requiem for a Dream / OST","1","1","155266","spotify:user:trinity3infinity","2016-02-18T17:47:12Z"
"spotify:track:3FBgNT3PC3R8q3lBnAQWvh","Iko Iko","The Belle Stars","Rain Man / Original Motion Picture Soundtrack","1","1","173933","spotify:user:becky1505","2016-02-19T10:34:59Z"
"spotify:track:5ONu4EF5vxDOCmBbQI6s0M","The Hanging Tree","James Newton Howard, Jennifer Lawrence","The Hunger Games: Mockingjay Pt. 1 (Original Motion Picture Score)","1","11","218506","spotify:user:becky1505","2016-02-19T10:41:44Z"
"spotify:track:3HQ9Dzqm9bYGAs4xVjcbYj","Friend Like Me - From "Aladdin"/Soundtrack Version","Robin Williams","Aladdin Special Edition (International Version)","1","6","146453","spotify:user:becky1505","2016-02-19T10:45:37Z"
"spotify:track:7aHRctaQ7vjxVTVmY8OhAA","We Built This City","Starship","Knee Deep In The Hoopla","1","1","296080","spotify:user:becky1505","2016-02-19T10:47:06Z"
"spotify:track:7nemcVsXVFZF01iqpIIo2Y","It's a Long Way to the Top (If You Wanna Rock 'N' Roll)","AC/DC","High Voltage","1","1","301226","spotify:user:becky1505","2016-02-19T10:49:42Z"
"spotify:track:4KsiwmpK6OsCiKs8t3uL5w","Platoon: Adagio for Strings","Best Movie Soundtracks","The Very Best of the Movie Soundtracks: Gold Edition","1","18","493988","spotify:user:eatyourgreens","2016-02-19T13:58:56Z"
"spotify:track:7tPUig2LybyxyC0SDrgJuT","Hangin' Out","2 LIVE CREW","Goes To The Movies / A Decade Of Hits","1","6","156240","spotify:user:eatyourgreens","2016-02-19T14:06:11Z"
"spotify:track:7bS4V9DNyqJJV2ibtO0axH","Shoop","Salt-N-Pepa","Deadpool (Original Motion Picture Soundtrack)","1","4","248560","spotify:user:eatyourgreens","2016-02-19T14:27:38Z"
"spotify:track:6voaSaf45PtbF8TG1CpjQx","Purple Rain (From "Purple Rain")","Soundtrack, Best Movie Soundtracks, The TV Theme Players","Best Movie & Tv Tunes","1","14","275627","spotify:user:trinity3infinity","2016-02-19T16:28:46Z"
"spotify:track:0KE5Uw9yO4ROgON70Gnihb","Outlands","Daft Punk","TRON: Legacy","1","9","162480","spotify:user:eatyourgreens","2016-02-19T16:09:10Z"
"spotify:track:23WHTR4EN7QUx1oqa2z0zh","We Own It (Fast & Furious)","2 Chainz, Wiz Khalifa","B.O.A.T.S. II #METIME (Deluxe)","1","18","227906","spotify:user:eatyourgreens","2016-02-19T16:11:35Z"
"spotify:track:2Fyz3wjxtUP1WvidFxPBry","Magic Dance (Single Version) - 2002 Remastered Version","David Bowie","Magic Dance E.P.","1","1","227323","spotify:user:12184019594","2016-02-19T16:25:42Z"
"spotify:track:1yo16b3u0lptm6Cs7lx4AD","Fight The Power","Public Enemy","Fear Of A Black Planet","1","20","282640","spotify:user:12184019594","2016-02-19T16:27:24Z"
"spotify:track:0RiKh2Fqbbhm5BT7hhkXf4","Nothing In This World Can Stop Me Worrin' Bout That Girl","The Kinks","Rushmore","1","4","162200","spotify:user:1264248857","2016-02-19T16:29:42Z"
"spotify:track:3vDFysmUvrzTmiFpk8UG90","The Flat Foot Floogie","Slim Gaillard","Blues Boogie","1","1","172040","spotify:user:1264248857","2016-02-19T16:30:08Z"
"spotify:track:3V7joCdcGXAW9w7o7ctLvX","You Will Be My Ain True Love","Alison Krauss","Cold Mountain (Music From the Miramax Motion Picture)","1","8","151800","spotify:user:1264248857","2016-02-19T16:30:51Z"
"spotify:track:5AhDb4oM6f4YmHPXW123Fg","I Am A Man Of Constant Sorrow - O Brother, Where Art Thou? Soundtrack/Radio Station Version","The Soggy Bottom Boys, Dan Tyminski","O Brother, Where Art Thou? (Soundtrack)","1","5","190000","spotify:user:1264248857","2016-02-19T16:32:02Z"
"spotify:track:6mcxQ1Y3uQRU0IHsvdNLH1","Where Is My Mind?","Pixies","Surfer Rosa (Remastered)","1","7","236973","spotify:user:trinity3infinity","2016-02-19T16:43:09Z"
"spotify:track:648BMGrt98kUbLo24A4vgj","Hip To Be Square","Huey Lewis & The News","Fore!","1","5","245466","spotify:user:12184019594","2016-02-19T17:16:42Z"
"spotify:track:4Wrc3Jz4POj0ibPj5iuq0r","Just Dropped In (To See What Condition My Condition Was In)","The First Edition","The First Edition","1","2","201213","spotify:user:12184019594","2016-02-19T17:17:57Z"
"spotify:track:2SWBfqj1FrS8t8z56G55rP","I Got You Babe","Sonny & Cher","The Beat Goes On: Best Of","1","4","193840","spotify:user:12184019594","2016-02-19T17:18:28Z"
"spotify:track:5qz5eX8HIWfMGuaPCdI086","Injection (From "Mission: Impossible II")","London Music Works, Francesca Genco","The Best of Hans Zimmer","2","1","293413","spotify:user:21kymv5meu6ckaalxjjxf7rwq","2016-02-23T11:15:31Z"
"spotify:track:7jnEVqyvscIaGLsJ8ezkEV","Mhysa","Ramin Djawadi","Game Of Thrones (Music from the HBO® Series) Season 3","1","18","234933","spotify:user:21kymv5meu6ckaalxjjxf7rwq","2016-02-23T11:16:52Z"
"spotify:track:0gSEyG7pOFuHM05433EibX","Into The West","Annie Lennox","Lord Of The Rings 3-The Return Of The King (U.S. Version-Jewelcase)","1","19","347600","spotify:user:21kymv5meu6ckaalxjjxf7rwq","2016-02-23T11:20:44Z"
"spotify:track:6hVCbm0GUwlQjuBv3oBgqn","Gabriels Oboe - From "The Mission"","André Rieu, Johann Strauss Orchestra","Gabriels Oboe (From "The Mission")","1","1","281266","spotify:user:21kymv5meu6ckaalxjjxf7rwq","2016-02-23T11:20:56Z"
"spotify:track:7MGFhIe9CBI5baTwLMj7iE","A Gift Of A Thistle","James Horner, London Symphony Orchestra","Braveheart - Original Motion Picture Soundtrack","1","2","97666","spotify:user:21kymv5meu6ckaalxjjxf7rwq","2016-02-23T11:23:15Z"
"spotify:track:2gpjRE4SIGX3VbR83zSdoX","Stand Up - Kick Ass film score version","The Prodigy","Kick-Ass: The Score","1","2","212346","spotify:user:cmk82","2016-02-24T10:47:37Z"
"spotify:track:4IX9XXY7GucsPmV3nhmTzW","Mad World - From Donnie Darko","Movie Sounds Unlimited","Greatest Movie Themes: 2000's","1","50","181000","spotify:user:cmk82","2016-02-24T10:53:38Z"
"spotify:track:3IRYrM9MVI79zHkWoiulnV","Rey's Theme","John Williams","Star Wars: The Force Awakens (Original Motion Picture Soundtrack)","1","6","191066","spotify:user:cmk82","2016-02-24T11:00:36Z"
"spotify:track:2u2McJSgHM5iHyOLSwWySb","Brand New Day","Neil Patrick Harris","Dr. Horrible's Sing-Along Blog (Motion Picture Soundtrack)","1","9","109704","spotify:user:cmk82","2016-02-24T11:29:32Z"
"spotify:track:4HHIVS7mHAXqXVebo3k5Um","You Know My Name - From "Casino Royale" Soundtrack","Chris Cornell","Carry On (International Version)","1","14","240120","spotify:user:cmk82","2016-02-24T11:46:04Z"
"spotify:track:1Hc9rfFRsUE8nyKDnyXg7f","American Beauty","Thomas Newman","American Beauty (Soundtrack)","1","8","187360","spotify:user:alexbowyer","2016-02-26T11:25:26Z"
"spotify:track:72VjtouKhCbaBol2e7tsaQ","Theme From Jurassic Park - Jurassic Park/Soundtrack Version","John Williams","Jurassic Park (Soundtrack)","1","2","207426","spotify:user:alexbowyer","2016-02-26T11:29:04Z"
"spotify:track:2UZ1CyjRcylsOTv1DUOxTE","In the House - In a Heartbeat (From "28 Days Later")","London Music Works","Music from Sunshine & 28 Days Later","1","2","261893","spotify:user:alexbowyer","2016-02-26T11:30:13Z"
"spotify:track:0tHOTQBn2M4CD2dcyHivth","Burn","The Cure","The Crow Original Motion Picture Soundtrack","1","1","398933","spotify:user:alexbowyer","2016-02-26T11:32:45Z"
"spotify:track:1rJalHUpS9b3gDmgsaUSg2","People Are Strange","Echo & the Bunnymen","The Best of Echo & The Bunnymen","1","11","218346","spotify:user:alexbowyer","2016-02-26T11:33:17Z"
